{
  "schema_version": "1.0",
  "suite_id": "public-runtime-stability-v1",
  "description": "Public, reproducible runtime-stability workload for transport, timeout, isolation, and usage-telemetry diagnostics. It is not a protected benchmark and must not support generalization claims.",
  "cases": [
    {
      "case_id": "inventory-evidence-reconciliation",
      "domain": "evidence_synthesis",
      "contract": {
        "schema_version": "1.0",
        "contract_id": "runtime-stability-inventory-evidence-reconciliation",
        "objective": "Reconcile inventory movements from three independent evidence sources and return the available quantity, status, and complete source set.",
        "inputs": {
          "ledger": {
            "opening_units": 1250,
            "receipt_batches": [
              180,
              95,
              75
            ],
            "customer_returns": [
              12,
              8
            ],
            "shipment_batches": [
              620,
              210
            ],
            "damaged_units": 25,
            "reserved_units": 140
          },
          "sources": [
            {
              "source_id": "warehouse-ledger",
              "role": "movement totals",
              "revision": 7
            },
            {
              "source_id": "damage-register",
              "role": "write-offs",
              "revision": 3
            },
            {
              "source_id": "reservation-book",
              "role": "committed stock",
              "revision": 11
            }
          ],
          "rules": {
            "formula": "opening + receipts + returns - shipments - damaged - reserved",
            "balanced_label": "reconciled",
            "negative_label": "investigate"
          },
          "audit_notes": [
            "Receipt batches are posted before shipment batches.",
            "Reserved units remain physically present but are not available.",
            "Damage write-offs must be deducted exactly once."
          ],
          "result_spec": {
            "spec_version": "2.0",
            "type": "object",
            "required": [
              "verified_available_units",
              "reconciliation_status",
              "source_ids"
            ],
            "additional_properties": false,
            "properties": {
              "verified_available_units": {
                "type": "integer"
              },
              "reconciliation_status": {
                "type": "string"
              },
              "source_ids": {
                "type": "array",
                "items": {
                  "type": "string"
                }
              }
            }
          },
          "semantic_assertions": [
            {
              "assertion_id": "inventory-balance",
              "operator": "equals",
              "left": {
                "op": "ref",
                "source": "result",
                "pointer": "/verified_available_units"
              },
              "right": {
                "op": "subtract",
                "args": [
                  {
                    "op": "add",
                    "args": [
                      {
                        "op": "ref",
                        "source": "inputs",
                        "pointer": "/ledger/opening_units"
                      },
                      {
                        "op": "sum",
                        "args": [
                          {
                            "op": "ref",
                            "source": "inputs",
                            "pointer": "/ledger/receipt_batches"
                          }
                        ]
                      },
                      {
                        "op": "sum",
                        "args": [
                          {
                            "op": "ref",
                            "source": "inputs",
                            "pointer": "/ledger/customer_returns"
                          }
                        ]
                      }
                    ]
                  },
                  {
                    "op": "add",
                    "args": [
                      {
                        "op": "sum",
                        "args": [
                          {
                            "op": "ref",
                            "source": "inputs",
                            "pointer": "/ledger/shipment_batches"
                          }
                        ]
                      },
                      {
                        "op": "ref",
                        "source": "inputs",
                        "pointer": "/ledger/damaged_units"
                      },
                      {
                        "op": "ref",
                        "source": "inputs",
                        "pointer": "/ledger/reserved_units"
                      }
                    ]
                  }
                ]
              }
            },
            {
              "assertion_id": "inventory-status",
              "operator": "equals",
              "left": {
                "op": "ref",
                "source": "result",
                "pointer": "/reconciliation_status"
              },
              "right": {
                "op": "ref",
                "source": "inputs",
                "pointer": "/rules/balanced_label"
              }
            },
            {
              "assertion_id": "inventory-source-set",
              "operator": "set_equals",
              "left": {
                "op": "ref",
                "source": "result",
                "pointer": "/source_ids"
              },
              "right": {
                "op": "project",
                "args": [
                  {
                    "op": "ref",
                    "source": "inputs",
                    "pointer": "/sources"
                  }
                ],
                "pointer": "/source_id"
              }
            }
          ]
        },
        "constraints": [
          "Use only the supplied records, rules, and reference values.",
          "Apply every stated arithmetic, filtering, ordering, and date rule before producing the result.",
          "Return exactly the keys and nested types declared by result_spec; do not add explanatory result fields.",
          "Include an evidence item with evidence_id inventory-evidence-reconciliation-source that cites the supplied diagnostic records.",
          "Do not request actions, access external systems, or infer missing values."
        ],
        "acceptance_criteria": [
          {
            "criterion_id": "inventory-evidence-reconciliation-result",
            "description": "The structured result satisfies every visible deterministic relation.",
            "required_evidence": [
              "inventory-evidence-reconciliation-source"
            ]
          }
        ],
        "allowed_actions": [],
        "forbidden_actions": [
          "filesystem.read",
          "network.access",
          "shell.execute",
          "external.publish"
        ],
        "risk_level": "low",
        "max_attempts": 2,
        "requires_human_approval": false
      },
      "expected_result": {
        "verified_available_units": 625,
        "reconciliation_status": "reconciled",
        "source_ids": [
          "warehouse-ledger",
          "damage-register",
          "reservation-book"
        ]
      }
    },
    {
      "case_id": "program-budget-reconciliation",
      "domain": "quantitative_reconciliation",
      "contract": {
        "schema_version": "1.0",
        "contract_id": "runtime-stability-program-budget-reconciliation",
        "objective": "Reconcile authorization, commitments, payments, remaining funds, and percentage utilization under one visible budget formula.",
        "inputs": {
          "budget": {
            "initial": 450000,
            "supplements": [
              25000,
              10000
            ],
            "committed": [
              120000,
              88500,
              46250
            ],
            "paid": [
              74000,
              31500
            ]
          },
          "rounding": {
            "percentage_digits": 2,
            "percentage_multiplier": 100
          },
          "labels": {
            "healthy": "within_plan",
            "exhausted": "over_plan"
          },
          "calculation_notes": [
            "Supplements increase the authorized budget.",
            "Committed and paid amounts are distinct uses and must both be deducted.",
            "Utilization is total use divided by total authorization, multiplied by 100."
          ],
          "control_totals": {
            "line_count": 7,
            "currency": "USD"
          },
          "result_spec": {
            "spec_version": "2.0",
            "type": "object",
            "required": [
              "authorized_budget",
              "total_used",
              "remaining_budget",
              "utilization_percent",
              "status"
            ],
            "additional_properties": false,
            "properties": {
              "authorized_budget": {
                "type": "integer"
              },
              "total_used": {
                "type": "integer"
              },
              "remaining_budget": {
                "type": "integer"
              },
              "utilization_percent": {
                "type": "number"
              },
              "status": {
                "type": "string"
              }
            }
          },
          "semantic_assertions": [
            {
              "assertion_id": "authorized-budget",
              "operator": "equals",
              "left": {
                "op": "ref",
                "source": "result",
                "pointer": "/authorized_budget"
              },
              "right": {